{
  "version": "runar-v1.0.0-rc.1",
  "compilerVersion": "1.0.0-rc.1",
  "contractName": "P2PKH",
  "abi": {
    "constructor": {
      "params": [
        {
          "name": "pubKeyHash",
          "type": "Addr"
        }
      ]
    },
    "methods": [
      {
        "name": "unlock",
        "params": [
          {
            "name": "sig",
            "type": "Sig"
          },
          {
            "name": "pubKey",
            "type": "PubKey"
          }
        ],
        "isPublic": true
      }
    ]
  },
  "script": "a9007c7c8769007c7cac69",
  "asm": "OP_HASH160 OP_0 OP_SWAP OP_SWAP OP_EQUAL OP_VERIFY OP_0 OP_SWAP OP_SWAP OP_CHECKSIG OP_VERIFY",
  "buildTimestamp": "2026-02-28T18:26:30.070Z",
  "ir": {
    "anf": {
      "contractName": "P2PKH",
      "properties": [
        {
          "name": "pubKeyHash",
          "type": "Addr",
          "readonly": true
        }
      ],
      "methods": [
        {
          "name": "constructor",
          "params": [
            {
              "name": "pubKeyHash",
              "type": "Addr"
            }
          ],
          "body": [
            {
              "name": "t0",
              "value": {
                "kind": "load_prop",
                "name": "pubKeyHash"
              }
            },
            {
              "name": "t1",
              "value": {
                "kind": "call",
                "func": "super",
                "args": [
                  "t0"
                ]
              }
            },
            {
              "name": "t2",
              "value": {
                "kind": "load_prop",
                "name": "pubKeyHash"
              }
            },
            {
              "name": "t3",
              "value": {
                "kind": "update_prop",
                "name": "pubKeyHash",
                "value": "t2"
              }
            }
          ],
          "isPublic": false
        },
        {
          "name": "unlock",
          "params": [
            {
              "name": "sig",
              "type": "Sig"
            },
            {
              "name": "pubKey",
              "type": "PubKey"
            }
          ],
          "body": [
            {
              "name": "t0",
              "value": {
                "kind": "load_param",
                "name": "pubKey"
              }
            },
            {
              "name": "t1",
              "value": {
                "kind": "call",
                "func": "hash160",
                "args": [
                  "t0"
                ]
              }
            },
            {
              "name": "t2",
              "value": {
                "kind": "load_prop",
                "name": "pubKeyHash"
              }
            },
            {
              "name": "t3",
              "value": {
                "kind": "bin_op",
                "op": "===",
                "left": "t1",
                "right": "t2",
                "result_type": "bytes"
              }
            },
            {
              "name": "t4",
              "value": {
                "kind": "assert",
                "value": "t3"
              }
            },
            {
              "name": "t5",
              "value": {
                "kind": "load_param",
                "name": "sig"
              }
            },
            {
              "name": "t6",
              "value": {
                "kind": "load_param",
                "name": "pubKey"
              }
            },
            {
              "name": "t7",
              "value": {
                "kind": "call",
                "func": "checkSig",
                "args": [
                  "t5",
                  "t6"
                ]
              }
            },
            {
              "name": "t8",
              "value": {
                "kind": "assert",
                "value": "t7"
              }
            }
          ],
          "isPublic": true
        }
      ]
    }
  }
}
