{
  "version": "runar-v0.1.0",
  "compilerVersion": "0.1.0",
  "contractName": "Stateful",
  "abi": {
    "constructor": {
      "params": [
        {
          "name": "count",
          "type": "bigint"
        },
        {
          "name": "maxCount",
          "type": "bigint"
        }
      ]
    },
    "methods": [
      {
        "name": "increment",
        "params": [
          {
            "name": "amount",
            "type": "bigint"
          },
          {
            "name": "txPreimage",
            "type": "SigHashPreimage"
          }
        ],
        "isPublic": true
      },
      {
        "name": "reset",
        "params": [
          {
            "name": "txPreimage",
            "type": "SigHashPreimage"
          }
        ],
        "isPublic": true
      }
    ]
  },
  "script": "76009c63757b210279be667ef9dcbbac55a06295ce870b07029bfcdb2dce28d959f2815b16f81798ac6969007c7c7c9376007c7ca169765880aa0082012c947f7701207f757b7c876967757c210279be667ef9dcbbac55a06295ce870b07029bfcdb2dce28d959f2815b16f81798ac696900765880aa0082012c947f7701207f757b7c876968",
  "asm": "OP_DUP OP_0 OP_NUMEQUAL OP_IF OP_DROP OP_ROT <0279be667ef9dcbbac55a06295ce870b07029bfcdb2dce28d959f2815b16f81798> OP_CHECKSIG OP_VERIFY OP_VERIFY OP_0 OP_SWAP OP_SWAP OP_SWAP OP_ADD OP_DUP OP_0 OP_SWAP OP_SWAP OP_LESSTHANOREQUAL OP_VERIFY OP_DUP OP_8 OP_NUM2BIN OP_HASH256 OP_0 OP_SIZE <2c> OP_SUB OP_SPLIT OP_NIP <20> OP_SPLIT OP_DROP OP_ROT OP_SWAP OP_EQUAL OP_VERIFY OP_ELSE OP_DROP OP_SWAP <0279be667ef9dcbbac55a06295ce870b07029bfcdb2dce28d959f2815b16f81798> OP_CHECKSIG OP_VERIFY OP_VERIFY OP_0 OP_DUP OP_8 OP_NUM2BIN OP_HASH256 OP_0 OP_SIZE <2c> OP_SUB OP_SPLIT OP_NIP <20> OP_SPLIT OP_DROP OP_ROT OP_SWAP OP_EQUAL OP_VERIFY OP_ENDIF",
  "buildTimestamp": "2026-02-28T18:22:57.134Z",
  "stateFields": [
    {
      "name": "count",
      "type": "bigint",
      "index": 0
    }
  ]
}
